{
  "$schema": "http://json-schema.org/draft-07/schema#",
  "title": "tpp project configuration",
  "description": "Configuration file for a tpp template project. Place tpp-config.json in the project root.",
  "type": "object",
  "additionalProperties": false,
  "properties": {
    "types": {
      "type": "array",
      "description": "Glob patterns (relative to this config file) for type definition files (.tpp).",
      "items": {
        "type": "string",
        "description": "A glob pattern such as \"*.tpp\" or \"types/*.tpp\"."
      },
      "default": []
    },
    "templates": {
      "type": "array",
      "description": "Glob patterns (relative to this config file) for template source files (.tpp).",
      "items": {
        "type": "string",
        "description": "A glob pattern such as \"*.tpp\" or \"templates/*.tpp\"."
      },
      "default": ["*.tpp"]
    },
    "replacement-policies": {
      "type": "array",
      "description": "Paths (relative to this config file) to replacement-policy JSON files.",
      "items": {
        "type": "string",
        "description": "A path to a replacement-policy JSON file."
      },
      "default": []
    },
    "previews": {
      "type": "array",
      "description": "Preview configurations used by the LSP to render the template with sample input.",
      "items": {
        "type": "object",
        "additionalProperties": false,
        "required": ["template"],
        "properties": {
          "name": {
            "type": "string",
            "description": "Optional display name for this preview entry."
          },
          "template": {
            "type": "string",
            "description": "Name of the template function to render (e.g. \"main\")."
          },
          "language": {
            "type": "string",
            "description": "Optional syntax-highlighting language hint for the VS Code preview panel (for example \"cpp\", \"swift\", or \"json\"). If both language and fileExtension are set, language wins."
          },
          "fileExtension": {
            "type": "string",
            "description": "Optional file-extension hint for the VS Code preview panel, with or without a leading dot (for example \".cpp\" or \"swift\"). Used when language is omitted."
          },
          "signature": {
            "type": "array",
            "description": "Optional parameter type signature used to disambiguate overloaded templates (e.g. [\"string\"] or [\"list<string>\"]).",
            "items": {
              "type": "string"
            }
          },
          "input": {
            "description": "Input data for the template. Either an inline JSON value or a path string pointing to a .json file relative to this config.",
            "oneOf": [
              { "type": "string", "description": "Path to a JSON input file, relative to this config." },
              { "type": "object", "description": "Inline JSON object input." },
              { "type": "array",  "description": "Inline JSON array input." }
            ]
          }
        }
      },
      "default": []
    }
  }
}
