{
    "types": [
        "typedefs.tpp"
    ],
    "templates": [
        "template.tpp"
    ],
    "replacement-policies": [
        "escape-lt.policy.json"
    ],
    "previews": [
        {
            "template": "main",
            "input": {
                "a": "x<y",
                "b": "x<y"
            },
            "name": "default"
        }
    ]
}
