{
    "types": [
        "typedefs.tpp"
    ],
    "templates": [
        "template.tpp"
    ],
    "replacement-policies": [
        "escape-lt.policy.json"
    ],
    "previews": [
        {
            "template": "main",
            "input": {
                "values": [
                    "a<b",
                    "x<y"
                ]
            },
            "name": "default"
        }
    ]
}
